{
  "goal_id": "2026-06-22-opticon-surface-tc2",
  "repo": "",
  "coordinator_root_path": ".",
  "period": "day",
  "period_value": "2026-06-22",
  "declared_by_machine": "machine-b",
  "declared_at": "2026-06-22T08:00:00Z",
  "text": "Finish tc-2 work-state contract and unblock project-opticon.",
  "status": "active",
  "provenance": {
    "source_kind": "coordinator_artifact",
    "repo": ".claude-prime",
    "ref": { "branch": "work/machine-b/2026-06-17to22", "sha": "647732fa" },
    "path": "state/goals/2026-06-22.yaml",
    "observed_at": "2026-06-22T08:00:01Z",
    "derivation": "parsed"
  }
}
